,fecha,titulo,descripcion
248,"enero 16, 2021",Pillos tenían ‘chulla cachina’ para asaltar en Guayaquil,La Policía capturó a delincuentes que asaltaron a una pareja. Un cuchillo forma parte de las evidencias
249,"enero 14, 2021","Un detenido por asalto fuera de un banco fue perdonado por su víctima ""en nombre de Jesús""",Implicado en un robo de 10 'lucas' a un ciudadano fue capturado con el billete en el sur de la urbe. Otro involucrado escapó
250,"enero 13, 2021",¡Cónchale vale! caen dos extranjeros acusados de robar $ 5.000 en Guayaquil,Los extranjeros iban armados y trataron de huir de la Policía cuando les pidieron que se detengan para un control
251,"enero 12, 2021",Guayaquil: Los 'choros' aprovecharon Navidad y Fin de Año para robar domicilios,El 2020 se cerró con 6.571 denuncias por robo a casas a nivel nacional. En Guayaquil se citó constantemente a un Sportage negro con placas clonadas entre los protagonistas
252,"enero 11, 2021","Maniatado, golpeado y asfixiado en Lago Agrio",Así fue encontrado el hermano de un candidato para la Asamblea Nacional en Sucumbíos. La policía indaga si se trató de un robo o un ajuste de cuentas.
253,"enero 11, 2021","Un malandrín se escondió bajo un carro, pero no pudo escapar de la ley","El sospechoso y un compinche, implicados en un robo, fueron detenidos por la Policía. El asalto ocurrió en el suburbio de Guayaquil"
254,"enero 11, 2021",La actriz porno Amaranta Hank sorprendió a sus fánaticos con su boda civil,"El afortunado que 'robó' el corazón de la colombiana es David Ortíz, hijo del actor Alfonso Ortíz, quien falleció recientemente"
255,"enero 08, 2021",Robo de tapas de alcantarillas en Quito suma 500.000 dólares en pérdidas,"En los dos últimos meses, según la EPMAPS, aumentaron los hurtos de tapas de alcantarillas en la capital ecuatoriana. Ciudadanos se las ingenian para tapar los huecos"
256,"enero 07, 2021",Dos bandidos asaltaban a bordo de una tricimoto en Bastión Popular,"Tras una persecución policial después de un robo, los presuntos delincuentes fueron detenidos en la vecina ciudadela Mucho Lote"
257,"enero 06, 2021",Otros cuatro 'fuera de la ley' detenidos en distintos sectores de Guayaquil,Dos hombres fueron aprehendidos por robos a personas y otros dos por portar armas y drogas
258,"enero 05, 2021",Pillo les dañó la reapertura de su negocio,"En el norte de Guayaquil, dos sujetos se metieron a una vivienda de la ciudadela Martha de Roldós para robar. Un sospechoso fue detenido"
259,"enero 04, 2021",Lo atraparon 'turqueándose' en una camioneta robada en octubre de 2020,Un hombre fue detenido para investigaciones por posesión de un automotor reportado como robado. Alegó que lo compró en la feria de carros usados
260,"enero 03, 2021",¡Le robaron $ 100 y la vida!,"La mujer permaneció 8 días hospitalizada. Fue baleada en el recinto Pocos Palos, de Durán"
261,"enero 02, 2021",Pillos se ‘divierten’ con los carros en un barrio guayaquileño,"En las calles García Goyena y Guerrero Valenzuela, los moradores han sido víctimas del robo de accesorios de sus vehículos"
262,"enero 01, 2021",¡'Chumadito' y asaltado!,"En la ciudadela Valle de los Geranios, al norte de Guayaquil, un ciudadano fue abandonado luego de supuestamente sufrir un robo"
263,"diciembre 31, 2020",En Quito: ¡Se equivocaron de ‘choros’!,"Luego de un asalto al estilo sacapintas, la Policía detuvo a dos sospechosos, pero cuando la víctima los reconoció no eran ellos."
264,"diciembre 29, 2020",Un pillo lo 'fogoneó' por resistirse al robo del celular,"La víctima, que se encontraba almorzando en un local en el sur de Guayaquil, recibió dos tiros"
265,"diciembre 29, 2020",Utilizaban una tricimoto y una pistola de juguete para asaltar en el sector El Fortín,"Cinco supuestos hampones fueron detenidos el 28 de diciembre. Según la Policía, ellos habrían asaltado a un transeúnte en el noroeste de Guayaquil"
266,"diciembre 28, 2020",¡Dice que fue “robada” de bebé!,Ana Karina sentía que no encajaba con su familia. Ellos le dijeron que su madre biológica la había regalado... Pero hay cosas que no concuerdan.
267,"diciembre 28, 2020",Ladrones 'pelaron' una peluquería en el suroeste de Guayaquil,En un vídeo difundido en las redes sociales se observa cómo un malandrín saca objetos del local y los embarca en un vehículo
268,"diciembre 28, 2020",Capacitan a la Policía para evitar el robo y la fuga de objetos del patrimonio cultural,En el territorio nacional se han recuperado unos 10.000 objetos culturales patrimoniales y además se ha repatriado más de 4.000 desde otros países
269,"diciembre 24, 2020",Se les hizo ‘agua’ el billete robado,Policía detuvo a uno y recuperó el dinero que le habían quitado a una ciudadana que lo retiró de un banco
270,"diciembre 21, 2020",Se le bajaron 200 ‘lucas’ a un extranjero,Investigan al celador del edificio y a otras personas. El foráneo tenía el billete en su departamento.
271,"diciembre 21, 2020",Una banda de cuatreros fue sometida en Esmeraldas,La Policía agarró a cinco sujetos que presuntamente se dedicaban al robo de ganado en tres provincias
272,"diciembre 19, 2020",Cuatro delitos ‘rondarán’ al Metro,"Se identificó que el robo a personas, secuestro de menores, suicidios y ataques con bombas puedan ser ‘el dolor de cabeza’ de los quiteños."
273,"diciembre 18, 2020",Sospechan que ladrones tenían un 'soplón' en la compañía de seguridad que trabaja con banco asaltado,La policía capturó este viernes a los sospechosos del robo a agencia bancaria ocurrido el 26 de noviembre en un centro comercial de Guayaquil
274,"diciembre 18, 2020",Muerte de empresaria manabita no fue por robo,Policía descartó este delito porque todas sus pertenencias se hallaron dentro del carro donde quedó su cadáver
275,"diciembre 18, 2020",'Abuelo pillo' embobaba a sus víctimas para robar cilindros,Ha atacado en algunos restaurantes de la provincia de Los Ríos
276,"diciembre 18, 2020",El crimen no para: una mujer de 31 años fue asesinada hoy en la vía a Daule,"La Policía presume que no se trataría de un caso de robo, ya que a la víctima le dejaron sus objetos de valor este viernes 18 de diciembre"
277,"diciembre 18, 2020",Detienen a presuntos 'pillos' implicados en el robo en un banco en Guayaquil,Seis personas fueron capturadas la madrugada de este viernes. El delito ocurrió el 26 de noviembre
278,"diciembre 18, 2020",Le 'paran el carro' a una banda que robaba bicicletas en Quito,"En el norte de la capital fueron aprehendidos 8 sospechosos de cometer robos a personas, bajo la modalidad de estruche y hurto"
279,"diciembre 17, 2020","¡Hermano del fallecido 'Negro Jessy', con riesgo de que le den 'vire'!",Julio César Corozo permanece preso en Guayaquil. Es investigado por el robo en un bus. En prisión podría toparse con los supuestos asesinos de su ñaño
280,"diciembre 17, 2020",Retiró 3 mil dólares y enseguida se los quitaron,"Los pillos lo interceptaron en Babahoyo. Dinero era para pagar a obreros en Baba, a donde se dirigían las víctimas"
281,"diciembre 17, 2020","Pillos se chocaron en plena persecución, en Quito",Ocurrió en el centro-norte de la capital. Los sospechosos fueron capturados con un arma de fuego y objetos robados. Dos de ellos huyeron
282,"diciembre 17, 2020",¡Relajados para robar un vehículo!,"Con tranquilidad y parsimonia, un hombre se llevó los objetos de valor de un auto estacionado en Cumbayá."
283,"diciembre 16, 2020",A punta de gritos le aguó la fiesta a dos choros que se le llevaban $ 20.000,"La Policía capturó a dos sacapintas al escuchar a un ciudadano que pedía ayuda, porque le habían despojado del dinero, en el centro de Guayaquil"
284,"diciembre 15, 2020",A 'cana' y multado por falsa alerta de robo,"En Loja, un hombre fue sancionado con privación de libertad y también debe hacer una reparación económica debido a que reportó un supuesto delito."
285,"diciembre 15, 2020",Robo y agresión a dos ciudadanos en el centro de Guayaquil,Los casos ocurrieron en el centro de Guayaquil la mañana de este lunes
286,"diciembre 13, 2020",Banda que al parecer integraba exfutbolista iba a asaltar otra entidad,Policía dio más detalles del grupo. A cuatro se les dictó prisión preventiva para investigaciones en torno a un intento de robo en Ibarra
287,"diciembre 13, 2020",Exfutbolista detenido en frustrado robo,Junto con otros sujetos habría intentado asaltar a una cooperativa de ahorro y crédito de Ibarra
288,"diciembre 12, 2020","En Carcelén: Linchado, pero vivo","Un hombre habría entrado a una vivienda, lo detuvieron, hubo audiencia y salió libre. Cuando los afectados lo encontraron, le 'cayeron'."
289,"diciembre 08, 2020",Los pillaron con el secuestrado en el sur de Quito,La Policía desarticuló una banda que robaba a transeúntes. Al último lo retuvieron para llevarlo a sacar plata de cajeros automáticos.
290,"diciembre 08, 2020","Un agente de la ATM y otro de la CTE, a 'cana' por presunto 'choreo' en carreteras","Entre los involucrados también está una persona privada de la libertad, que lideraba los delitos desde la cárcel"
291,"diciembre 07, 2020",Choros 'madrugaron' a empleados y pasajeros de una compañía de transporte,A uno de los pasajeros se le habrían llevado 5 mil dólares en efectivo. El dueño del dinero fue herido de un cachazo en la cabeza
292,"diciembre 04, 2020",¡Dos pillos 'atrapados sin salida' en Urdesa!,Los hampones armados habían atracado a un ciudadano en su oficina y al tratar de huir fueron seguidos por guardias y cercados por la Policía
293,"diciembre 03, 2020",Dos detenidos por 'chorear' en un bus de Quito; una de las víctimas reconoció a uno de los pillos,Los sujetos estaría implicados en varios asaltos y robos en las unidades de transporte público de la capital
294,"diciembre 02, 2020",Policías detuvieron 'en roja' a dos asaltantes,"Robo fue impedido por agentes de la policía, en el norte de Guayaquil. El operativo dejó dos detenidos, uno de ellos intentó disparar contra un uniformado."
295,"noviembre 30, 2020","La Kennedy, en una espiral delictiva",La pareja acusada de un intento de robo en una pollería salió en libertad tras un acuerdo con el dueño. Ahora la gente teme que el sujeto vuelva.
296,"noviembre 27, 2020",Salvados de la ‘garrotiza’,"Pareja implicada en un intento de robo en La Kennedy, norte de Quito, fue confundida con la que la semana pasada asaltó una pizzería de la capital."
297,"noviembre 26, 2020",Adolescente llamó a la Policía desde abajo de su cama,Cuatro hombre habrían ingresado a su casa para robar. Tres lograron huir del lugar.
298,"noviembre 26, 2020","Por supuesto robo, en Lago Agrio le dan un disparo en la ceja a un cristiano",Los sospechosos del crimen fueron detenidos horas más tarde. Se presume que la motivación fue por robarle la moto
299,"noviembre 26, 2020","¡Dos presuntos asesinos, dos estafadores y una acusada de robo, al tarro!",Los operativos “Cero Impunidad” deja en Guayaquil otras cinco personas detenidas por tener cuentas pendientes con la justicia
300,"noviembre 26, 2020",En Quito los 'choros' se creen 'cocineros',Los ladrones usan cuchillos con mayor frecuencia durante los atracos para intimidar a las víctimas. La Policía dice que no hay incrementos en robos.
301,"noviembre 24, 2020",Hackers vaciaron sus cuentas,En Babahoyo ocurrieron dos delitos similares. A uno lo dejaron sin sueldo y a otra persona le debitaron dinero por compras que no hizo
302,"noviembre 24, 2020","Intentaron 'pelar' un departamento en el centro de Guayaquil, pero guardias los encerraron",Dos colombianos y una ecuatoriana están detenidos por intento de robo en un edificio. Las cámara de vigilancia ayudaron a atrapar a la mujer
303,"noviembre 24, 2020",Le roban el taxi y lo dejan tirado en la calle; luego les vino el karma,Dos sujetos amedrentaron a un conductor para que entregara su unidad. La Policía los persiguió hasta que chocaron
304,"noviembre 23, 2020",Para los pillos todo vale; uno intentó quitar a una mujer el regalo que llevaba a una matiné,"La Policía reportó que atrapó al sujeto y a otros 3 sospechosos que tenían armas de fuego, con las que cometían robos en distintos sitios de Guayaquil"
305,"noviembre 23, 2020","Otro violento robo en Quito, ahora con 'matachancho'",La cajera de un asadero de pollos fue víctima del brutal atraco en el norte de la ciudad
306,"noviembre 21, 2020",Implicado en robos en Quito hizo un 'tour' delictivo,El tipo que aparece junto a una mujer asaltando en una pizzería ha recorrido algunas provincias. La policía allanó una casa en el norte de la capital.
307,"noviembre 21, 2020",En diciembre serán juzgados sospechosos de robo en una finca,"Ayer, la Policía capturó a los cuatro supuestos implicados, en el kilómetro 30 de la vía a la costa"
308,"noviembre 21, 2020",Identificado el ensacado hallado en la isla Trinitaria de Guayaquil,El joven era oriundo de Santo Domingo de Tsáchilas. El robo habría sido las causas de su asesinato.
309,"noviembre 20, 2020",Vecinos de La Floresta ‘paniqueados’ por tanto robo,"Además de los asaltos, los residentes son víctimas de hurtos durante las noches."
310,"noviembre 20, 2020","A punta de escopeta, 'choros' habrían dado un golpe en una finca de la vía a la Costa",Cuatro sujetos fueron detenidos esta madrugada con el producto del robo. Los atraparon en las afueras de Guayaquil
311,"noviembre 20, 2020",'Tapiñaron' la pistola bajo la tapicería del auto,Cuatro hombres fueron detenidos por estar implicados en varios asaltos. Entre los aprehendidos había dos menores de edad.
312,"noviembre 20, 2020",Robo les duró pocas horas,"Detienen a dos sospechosos de un asalto a un transeúnte en el sector de Urdesa, norte de Guayaquil. Los sujetos 'camellaban' en un taxi amarillo."
313,"noviembre 20, 2020",Roban en menos de un minuto en el local del jugador Pedro Pablo Velasco,Triunfo 'agridulce' para el defensa del Barcelona. Delincuentes se le llevaron hasta las llaves del carro de la mujer de Velasco.
314,"noviembre 19, 2020",¡Les ‘bautizaron’ con una pistola!,"La pizzería que se volvió viral en redes sociales, luego de que se difundieran imágenes de un robo en su interior, tiene tres meses funcionando."
315,"noviembre 18, 2020",Final feliz para Pervis Estupiñán,"El tricolor recuperó una de las maletas que le robaron en Quito y lo más importante, el pasaporte para poder viajar hacia España"
316,"noviembre 17, 2020",Robó una máquina y la ofertó en redes sociales ¡la falla!,Un sujeto que se había llevado una fusionadora de fibra óptica fue detenido porque el dueño de la máquina vio el aviso
317,"noviembre 17, 2020",¡La señorita tenía dos ‘truenos’ en el pantalón!,La joven guardaba las pistolas que sus compinches habrían utilizado en el robo de una panadería del sur de Quito.
318,"noviembre 14, 2020",¡Asesinan a un anciano en un bosque del norte de Quito!,"La Policía presume que crimen sería por un intento de robo. Hay una mujer que, al parecer, estuvo con la víctima antes del suceso."
319,"noviembre 13, 2020","Enamoró a viejito en Perú, le robó 30 mil dólares y... ¡estaría en Ecuador!","La venezolana Johanna Alexandra Rodríguez le dejó un mensaje a su víctima: “Gracias por hacer mi sueño realidad pronto, te adoro"" y se dio a la fuga"
320,"noviembre 13, 2020","En 'Sambo' detienen a mucama que tomó las joyas y dinero ""para que no los embarguen""","La mujer estaría implicada en el robo en una casa de Ciudad Celeste, donde prestaba sus servicios. Ella afirma que le dieron la orden de esconderlos"
321,"noviembre 12, 2020",El glamour ante todo: antes de robar se peluquearon,En el sur de Quito fueron detenidas tres personas por robo y agresión dentro de un gabinete de belleza
322,"noviembre 12, 2020",Pescaban camarón de lo lindo... en una piscina que no era suya,"Tres sujetos fueron hallados en una camaronera del cantón Balao, en posesión de 800 libras del producto recién sacado del agua"
323,"noviembre 11, 2020",Defendió su vida y su negocio,"Intento de robo en el Empalme quedó registrado en cámaras. Motorizados llegaron a su tienda a robarle, pero ella no los dejó ingresar"
324,"noviembre 11, 2020",Regenerarse le costó la vida,Asesinato en el cantón Arenillas. Le dieron golpes y puñaladas por negarse a participar en el robo de una motocicleta
325,"noviembre 09, 2020",¡La violó y robó pero ella le mordió el pene y se lo desgarró!,Policías pudieron reunir los trozos del 'amiguito' para una posible reconstrucción.
326,"noviembre 09, 2020",¡Se les acabó el manguerazo!,Hacían huecos en las tuberías para extraer agua con bombas sin especificaciones técnicas ni salubridad. Empresa de Agua Potable de Mejía lo denunció
327,"noviembre 08, 2020",Siete detenidos por 'bajarle el billete' a usuarios de clínica de rehabilitación,Entre los aprendidos está una venezolana. Según la Policía con el dinero pretendían comprar un arma para delinquir
328,"noviembre 06, 2020",Le ‘pelaron’ la casa en sector privado y nadie vio el ‘choreo’,Robo se cometió en una urbanización de la vía a la parroquia Febres Cordero del cantón Babahoyo
329,"noviembre 06, 2020",Dos 'choros' extranjeros pelaron el diente ante las cámaras,"Dos sujetos que fueron aprehendidos luego de asaltar a una mujer en el sur de Quito, sonrieron al ser fotografiados en un cuartel policial"
330,"noviembre 06, 2020",Presos por robarse trastos de un parque de diversiones,La Policía aprehendió a tres sospechosos del robo perpetrado en un contenedor de una empresa de juegos
331,"noviembre 05, 2020",En persecución 'cayó' ciudadano con ocho detenciones anteriores,"El hombre fue capturado junto a otra persona, al ser vistos en una actitud inusual. Tenían una pistola en su poder"
332,"noviembre 01, 2020","¡Matan al salchipapero favorito, en Yaruquí!","Un hombre muy querido en Yaruquí, suroriente de Quito, fue asesinado en su domicilio. La Policía presume que se trataría de un intento de robo."
333,"octubre 29, 2020",Peruano 'cayó' con más de 6 'lucas' en Guayaquil,"El extranjero es sospechoso de cometer varios robos en los exteriores de la zona bancaria de la ciudadela Alborada, en el norte porteño."
334,"octubre 29, 2020",En la cooperativa El Buen Vivir no todo hace honor a su nombre,"Los problemas de drogas, violencia intrafamiliar y el robo a personas fueron ventilados en una asamblea vecinal promovida por la Policía Nacional"
335,"octubre 28, 2020",Robo o ajuste de cuentas en crimen de un tendero,En Balzar le dieron como cinco tiros delante de su esposa. Los criminales llegaron como clientes
336,"octubre 28, 2020",Asaltaban a la gente y se refugiaban en Socio Vivienda,"Tres presuntos implicados en el robo a trabajadores de una telefónica y a transeúntes, fueron sacados de las calles por la Policía"
337,"octubre 27, 2020","¡GPS le dañó el ‘camello’ a un pillo, en el norte de Quito!","El presunto delincuente ya había guardado la motocicleta en un domicilio, en el centro de la capital."
338,"octubre 27, 2020",¡Lista de compras ‘dormilona’!,"La empleada cree que el sujeto le puso escopolamina. En ese mismo negocio, situado en Sangolquí, un niña mañosa se robó dinero hace un mes."
339,"octubre 27, 2020","Repartió plomo a todos, menos al que buscaba","Un 'gatillero' chueco hirió a tres personas en el sur de Guayaquil, cerca de las casas colectivas de la avenida del Ejército."
340,"octubre 27, 2020",¡Intentaron fugarse en un bus luego del asalto!,Un hombre y un menor de edad habrían golpeado y quitado el celular a un señor.
341,"octubre 25, 2020",Las raptaron por sus bicicletas,"Tres ciclistas profesionales fueron asaltadas violentamente en la Ruta Viva, en Quito. A una le clavaron un destornillador en la clavícula."
342,"octubre 22, 2020","Tráiler fue abandonado en Ciudad Perdida, pero la Policía lo encontró","Tras perseguir a un hombre que rodaba el pesado camión con un contenedor, los agentes hallaron al automotor entre la maleza y luego a tres sospechosos"
343,"octubre 22, 2020",Hallan 5 motos y 265 piezas y partes en una vivienda de la Trinitaria,La Policía recuperó estos bienes y detuvo a 3 hombres luego de rastrear una motocicleta que había sido reportada como robada en el sur de Guayaquil
344,"octubre 21, 2020",En Quito atrapan a sacapintas que le había quitado tres 'lucas' a una mujer,La Policía desarticuló a una banda delictiva de extranjeros que se dedicaba a robar en los alrededores de las entidades financieras de la capital
345,"octubre 20, 2020",Usaron soldadura a gas para robar $ 140.000 de cajero en el sur de Guayaquil,Los vecinos no escucharon nada que los alertara del robo. La Policía afirma que los pillos usaron soldadura autógena para abrir la caja
346,"octubre 20, 2020",Un extranjero fue capturado con una 'nave' que habría robado,"La Policía detiene en Durán a un colombiano que, junto a otro sujeto, le habría quitado el vehículo a un hombre en el suburbio de Guayaquil"
347,"octubre 19, 2020","Iban a desalojar a hacheros, pero hallaron dos vehículos robados","En Colinas de la Alborada habían pedido ayuda para ahuyentar a consumidores de drogas. En su lugar, la Policía halló los carros dentro de un taller"
348,"octubre 18, 2020",¡‘Quiño’ para la Brandon en Montañita!,"Un hombre la acusaba de robo. Sin embargo, los policías no encontraron pruebas en su contra. Le pidieron que se fuera del balneario para evitar líos"
349,"octubre 17, 2020",Guayaquil: Supuesto pillo fue baleado tras intento de robo en el norte de la ciudad,"Un grupo de agentes estaba en un un local de comidas, ubicado en Urbanor, cuando un sujeto armado los sorprendió."
350,"octubre 16, 2020",¡Mafiosos camuflados de mercachifles operan en la capital!,Las autoridades alertan que miembros de bandas se hacen pasar por comerciantes para delinquir. El robo y el tráfico de droga entre sus delitos
351,"octubre 16, 2020",Sacaron a dos 'cortacables' de las mismas alcantarillas,"Los hombres, detenidos por la Policía, estaban implicados en cortar cables de luz e internet en la parroauia Alangasí, al suroriente de Quito"
352,"octubre 15, 2020",Atrapados en pleno desmantelamiento,Policía le siguió los pasos a un sujeto detenido y liberado en días anteriores por tentativa de robo y así pudo capturar a tres presuntos robacarros
353,"octubre 15, 2020",¡Niño héroe! Con cinco años ataca a ladrones armados para que se vayan de su casa,El pequeño David le lanzó sus juguetes y pegó a los malhechores. Su objetivo era defender a su mamá y evitar el robo en su hogar. Mira el video
354,"octubre 12, 2020",¡Dos rufianes meten miedo en la periferia de Quito!,La Policía investiga a dos sospechosos que hacen ‘de las suyas’ en las afueras de la capital. Cometieron asaltos a mano armada en los últimos días
355,"octubre 12, 2020",El 'manos rápidas' de Conocoto fue 'pillado' en un video,"Al parecer, el hombre finge hablar por teléfono para distraer al dependiente mientras mete en un bolso los productos de la tienda."
356,"octubre 10, 2020",¡La vida por un celular!,"Los delincuentes la interceptaron cuando iba a almorzar a la casa de su suegra. No solo le clavaron el objeto cortopunzante, también la patearon."
357,"octubre 09, 2020",Moda 'antichoros': ciudadanos los amarran en desquite por asaltos,Dos sospechosos de robar en una casa fueron atados a postes en el suroeste de Guayaquil. El 26 de septiembre hubo otro caso en la vía Perimetral
358,"octubre 08, 2020",¡Cuidado lo 'limpian' mientras anda por la 22 y Capitán Nájera!,Dos choros aprovecharon el descuido de un ciudadano para robarle sus pertenencias en ese sector del suburbio de Guayaquil. Una cámara registró el robo
359,"octubre 08, 2020","Cristiano Ronaldo, víctima de robo: ¡'Choros' entraron a su casa!",Delincuentes ingresaron al departamento del futbolista en la isla de Madeira (Portugal). ¿Qué se llevaron?
360,"octubre 07, 2020",Robaban entre ‘montoneros’ en el sur de Quito,Los sospechosos fueron detenidos minutos después de robar a un señor en Quitumbe.
361,"octubre 06, 2020",¡'Peluqueada' con 'choreo'!,Dos asaltantes hicieron de las suyas en una barbería en el norte de Guayaquil. Uno de los delincuentes fingió ser cliente para robar
362,"octubre 05, 2020","¡Dos revólveres, ocho balas y tres detenidos en Durán!","En Durán, la Policía detuvo a tres personas, quienes tenían armas en su poder, una de las cuales habría sido utilizada en un asalto"
363,"octubre 04, 2020",“Por un celular lo mataron”,Hay tres detenidos. Un amigo que acompañaba a la víctima teme por su seguridad.
364,"octubre 02, 2020","Ataque, asalto y enfrentamiento a bala",Quince pillos ingresaron a un inmueble y se llevaron 25 mil dólares
365,"octubre 02, 2020",Atado a un poste con su misma ropa por intento de robo,"Un sujeto de 22 años habría intentado asaltar a una joven en la vía a Samborondón, ella gritó y varias personas atraparon y golpearon al sospechoso"
366,"octubre 02, 2020",'Harto choro' en las estaciones del corredor,Cinco personas fueron detenidas en los andenes por atracar a los pasajeros.
367,"octubre 02, 2020",Disparan a comerciantes de ganado y se les llevan 5 mil dólares,Delincuentes los interceptaron cuando iban desde Los Ríos hasta Bolívar a realizar la transacción
368,"octubre 01, 2020",‘Héroe’ se recupera de la ‘chuzada’,"Un hombre que fue apuñalado por defender a sus familiares de un robo, fue operado ayer en Quito. Los sospechosos recibieron prisión preventiva."
369,"septiembre 30, 2020",A joven peluquero de Quito le cortan su mejor herramienta: los dedos,"Sucedió cerca del Mercado mayorista, en el sur de la capital, cuando tres sujetos se acercaron a la víctima y la acuchillaron"
