,fecha,titulo,descripcion
126,"abril 23, 2021",Guayaquil: Hombre compraba maduro asado cuando le 'chorearon' el celular,Los antisociales llegaron en un auto rojo y el robo quedó registrado en una cámara de seguridad
127,"abril 22, 2021",Policía se salvo por un 'pelito' porque a 'chamo' se le encasquilló el arma,"Minutos antes, el extranjero habría asaltado a una señora que salió de una agencia bancaria, se le llevó la cartera y el monedero"
128,"abril 22, 2021",Hay cuatro detenidos y dos autos y accesorios recuperados en Durán,"Uno de los vehículos habría sido utilizado en el intento de asesinato a uno de sus agentes, indica la Policía Judicial"
129,"abril 21, 2021",Policía víctima de robo fue asesinado de un disparo,Un agente de la Policía Judicial del Guayas fue mortalmente herido de bala en el suroeste de Guayaquil. La víctima realizaba trabajos para la Fiscalía
130,"abril 20, 2021",Guayaquil: balacera para tres y uno no sobrevivió,"En las calles Babahoyo y Chambers, al sur del Puerto Principal, ocurrió un ataque a 'plomo' esta tarde. Se descarta el robo como causa"
131,"abril 20, 2021",¡Chupa traicionera! Le robó $ 1.000 a su pana y los repartió para seguir bebiendo,"Un hombre fue detenido en Durán, acusado de hurtar el dinero que uno de los contertulios tenía escondido en su carro"
132,"abril 20, 2021",Detienen a dos pillos que se 'esfumaban' con 45 'lucas',"Los sujetos fueron atrapados en la vía a Daule, al norte de Guayaquil. Le habían sustraído el 'billete' al empleado de una entidad financiera"
133,"abril 19, 2021","Mujer que se enfrentó a delincuente asegura: ""¡Fuerte no, valiente sí!""","La durandeña dijo a EXTRA que si alguien intenta robarle lo volvería a enfrentar. El pillo dejó botadas la gorra, mascarilla y camiseta"
134,"abril 19, 2021","En Durán, mujeres se enfrentan a un delincuente y no se dejaron robar","El antisocial se fue sin su camisa, la gorra y la mascarilla, ocurrió la noche del sábado en un negocio de belleza"
135,"abril 16, 2021","Atropellado tras arranchar un celular, en el sur de Quito","Ocurrió en la parada de la Ecovía de Chimbacalle, al sur de la capital"
136,"abril 16, 2021","En Guayaquil, un detenido en pillerías lució 'felizote' ante las cámaras","El presunto antisocial y otro individuo fueron capturados por el robo de un teléfono celular, en el norte de Guayaquil. Se les encontró un cuchillo"
137,"abril 15, 2021",Guayaquil: Aguatero implicado en robo quedó libre porque ya había terminado la flagrancia,"Policía tramita boleta de captura en contra del vendedor de agua. Su presunto cómplice sí fue procesado, pero porque se le halló sobrecitos con droga"
138,"abril 14, 2021",Un camionero fue tiroteado por resistirse a un asalto en el Trinipuerto,Ocurrió en la entrada al sitio. La víctima recibió un tiro en el cuello. Los sospechosos se movilizaban en una bicicleta
139,"abril 14, 2021",Capturaron al sospechoso de robar a un conductor en el centro de Guayaquil,En su poder tenía 8 paquetitos de cocaína. El perjudicado lo identifica como la persona que metió la mano en su carro y tomó su teléfono celular
140,"abril 14, 2021",Presunto asaltante muere arrollado por un vehículo en el sur de Guayaquil,Moradores dijeron a los investigadores que el fallecido fue seguido por un conductor a quien habría intentado asaltar. Se le halló un arma de fuego
141,"abril 14, 2021",En pleno centro de Guayaquil aguateros meten mano a conductor y se le llevan el teléfono,El robo fue grabado por una persona que viajaba en un bus de transporte urbano. La Policía está tras la pista de los antisociales
142,"abril 13, 2021",Un 'choro' sin camisa se robó dos 'gambas' de un camión,"Un repartidor fue asaltado en Durán, pero logró ser auxiliado por un grupo de policías"
143,"abril 13, 2021",Arrestan a 7 extranjeros sospechosos de 'tumbar' lo ajeno en Samborondón,"Los 5 hombres y dos mujeres, todos colombianos, pertenecerían a banda dedicada al robo en vehículos parqueados en centros comerciales y viviendas"
144,"abril 12, 2021",¡Treinta y cuatro años y 8 meses de ‘cana’ a dos asesinos!,"Sujetos involucrados en un crimen, de abril del 2020, fueron sentenciados. La víctima vivía sola en su casa y los acusados le dieron una puñalada."
145,"abril 12, 2021",Los ‘pelaron’ y amenazaron con una granada,Familia de ciudadela San Felipe fue víctima del hampa. Los delincuentes encerraron a las víctimas en una pequeño baño
146,"abril 09, 2021",Quito: Los detenidos eran unos ‘fichitas’,Los aprehendidos en un operativo de drogas registran detenciones. Estarían involucrados en el robo a una joyería y a una casa de un artista quiteño.
147,"abril 09, 2021","En Perú le 'bajan el telón' a Los Cafichos de Ceres, una banda de venezolanos dedicada al robo y la extorsión","La Policía los venía investigando por extorsionar a comerciantes, meretrices y conductores. Se presume que también se dedicaban al expendio de drogas"
148,"abril 08, 2021",La Policía recupera dos 'naves' que se habían robado en Guayaquil,"Uno de los automotores estaba en poder de personas que, al ver a los agentes, se dieron a la fuga y lo abandonaron en el noroeste de la ciudad"
149,"abril 07, 2021",¡‘Marcada’ para morir!,"A víctima de envenenamiento la velaron ayer en su vivienda, donde apareció escrito el número 323. Un familiar cree que los pillos ‘eligieron’ su casa"
150,"abril 05, 2021",En Guayaquil le 'chorearon' el arma a guardia de un hotel,"Los antisociales llegaron en una motocicleta, forcejaron con el celador y con su mismo revolver le dispararon"
151,"abril 04, 2021",Guayaquil: Sorprendieron a delincuentes cuando robaban piezas,"Un lugareño observó cuando los individuos perpetraban el delito y alertó a la Policía. Luego, hubo una persecución y un patrullero terminó chocado."
152,"abril 04, 2021",Guayaquil: Asaltaban con arma de juguete,"Dos sujetos fueron detenidos tras el robo de teléfonos celulares a un grupo de personas, en el norte de la urbe porteña"
153,"abril 03, 2021","Robó cinco celulares ""para pagar una deuda""","El hecho se perpetró en la bahía comercial del centro de Guayaquil. El sujeto fue descubierto por su jefa, en un local de venta de teléfonos."
154,"abril 01, 2021",Conseguían plata para Los Choneros,Una banda se dedicaba al robo de vehículos en Quito como parte del financiamiento de esta organización narcodelictiva.
155,"marzo 31, 2021",Guayaquil: 'Narcochoreo',"Cinco personas ‘cayeron’ tras irrumpir en la casa donde una banda almacenaba droga, en Guayaquil. Serían miembros de la banda de Los Choneros"
156,"marzo 30, 2021","En Quito, pillos 'salados' son descubiertos al vender los productos robados","Habrían asaltado un taller en el norte de Quito y luego, sin saberlo, pretendieron vender el botín a un amigo de la víctima"
157,"marzo 30, 2021",Confuso asalto con muerte,Policía investiga si balacera ocurrida en centro comercial de Machala tiene relación con el hombre fallecido en centro de salud de Pasaje
158,"marzo 30, 2021",Caso Ruales: Fiscalía pide vincular a dos sospechosos a la investigación por asesinato,"Los individuos son alias Casquete, quien ya está procesado por el robo del vehículo usado en el crimen, y alias Choclo, el presunto líder"
159,"marzo 30, 2021",¡Hombre se 'choreó' juguete sexual de una tienda!,"El robo quedó captado en un video de la cámara de seguridad de un establecimiento de Ibagué, Colombia."
160,"marzo 30, 2021",'Pelaron' un trailer en el norte de Guayaquil,Unos diez delincuentes interceptaron el vehículo en el intercambiador de tránsito que conecta a las vías a Daule y Perimetral
161,"marzo 28, 2021","¡Robo, puñaladas y dolor en Guayaquil!","Supuestos pasajeros asaltaron a un taxista y luego lo abandonaron. Los implicados apuñalaron al conductor, quien luego de unas horas falleció"
162,"marzo 26, 2021",Robo de 50 'lucas' se le hizo 'agua' a un pillo,"Un sujeto pretendía asaltar a un ciudadano, quien había retirado dinero de una entidad bancaria en Urdesa, norte de Guayaquil"
163,"marzo 25, 2021","Torturados, asesinados y al agua",En El Oro hallaron cadáver de pescador en alta mar. Sería una de las tres víctimas de robo por los llamados piratas
164,"marzo 24, 2021",Baleada por un celular y 25 dólares,"Un mujer que regresaba de su trabajo fue víctima de robo. El delincuente le disparó en la pierna, la víctima murió debido a la grave herida."
165,"marzo 24, 2021",Detienen a dos 'pillos' que robaban el cerro Las Cabras,"Dos delincuentes fueron capturados por la Policía, luego de que asaltaran a una mujer en un populoso sector de Durán"
166,"marzo 24, 2021",Gustavo Enrique fue víctima de la delincuencia,Al cantante le robaron dos bolsos que contenían equipos electrónicos. Dice que solo quiere recuperar su pasaporte porque necesita salir del país
167,"marzo 22, 2021",Recuperaron vehículos robados en Guayaquil y otros dos cantones,"Operativos de rutina en Guayaquil, Durán y Samborondón detectan los automotores con restricciones de circulación"
168,"marzo 17, 2021",Entraron por un helado y les robaron el auto,"Mientras una familia entraba a un local, un sujeto les abría el auto y les robaba sus pertenencias en Pomasqui, norte de Quito."
169,"marzo 15, 2021",Acurrucados los agarró la policía,Detenidos luego de robo en centro comercial de Quevedo
170,"marzo 12, 2021",¡Amarraron a los dueños de un cíber y se 'chorearon' 8 'lucas'!,Tres hombres armados ingresaron al negocio ubicado en el centro de Guayaquil. En la cartera de la propietaria guardaron el billete que robaron
171,"marzo 12, 2021",¡Felipe 'El Loco' Crespo fue víctima de robo!,El influencer narra que lo apuntaron con un arma en la cabeza y se le llevaron sus pertenencias. El sospechoso tiene prisión preventiva...
172,"marzo 09, 2021",¡Pilas con el ladrón de la gorra en Cumbayá!,Víctimas de robos coinciden en que el sujeto llevaba un gorro blanco con una línea roja.
173,"marzo 08, 2021",En Quito mujer 'voló' del susto,"Adulta mayor fue asaltada y secuestrada. Para huir de los pillos, saltó del auto en donde la retuvieron."
174,"marzo 07, 2021",Mujer se lanzó de un auto mientras le robaban en Quito,"Sucedió en el norte de la capital. La víctima es una adulta mayor, quien se subió a un taxi y la amenazaron cuatro personas."
175,"marzo 06, 2021",La tragedia no lo deja vivir,Lo investigan por el fallecimiento del sospechoso de robo. Podría enfrentar una pena de hasta 10 años de prisión y cuenta que lo tiene atormentado.
176,"marzo 05, 2021",Fotitos del robo 'pa' el recuerdo' del Monumental,Ocurrió a las tres de la madrugada y todo quedó grabado en las cámaras del estadio.
177,"marzo 04, 2021",¡ Policía ‘voló’ en plena persecución!,"La patrulla se volcó y un agente salió ‘disparado’ por el parabrisas. El choro, quien huía con carro ajeno, sí ‘cayó’."
178,"marzo 04, 2021","Detienen a un 'pillo' luego de una persecución, en el sur de Quito",El sospechoso al parecer robaba a sus víctimas en una motocicleta. La Policía lo capturó luego de una denuncia ciudadana.
179,"marzo 04, 2021",Quito: Le robaron la ropa y hasta el pasaporte,Una joven venezolana fue asaltada en el norte de la capital. Iba con su hijo cuando dos hombres la atacaron
180,"marzo 04, 2021",Guayaquil: Arma encasquillada impide robo y asesinato,"Hombre impide que le roben a su hermano, pero delincuentes trataron de dispararle. El sospechoso fue detenido con un revólver"
181,"marzo 04, 2021",Guayaquil: Le robaron y luego pedían dinero por los documentos,Operativo deja tres detenidos en el norte de la ciudad. Los sospechosos serían parte de una banda de extorsionadores
182,"marzo 04, 2021",Barcelona: Se robaron una laptop en el Monumental,En el vídeo se observa como buscaron la computadora portátil desde el área administrativa del estadio.
183,"marzo 03, 2021",Con subametralladora asaltaron en avícola de Guayaquil,Se llevaron tres celulares y 280 dólares. El hecho quedó registrado en el sistema de vigilancia del negocio. No hay detenidos.
184,"marzo 02, 2021",Mujer es arrestada después de que la policía encontró residuos de Cheetos en sus dientes,"Sharon Carr fue arrestada por un cargo de robo en primer grado después de que los residuos de Cheetos la vincularan con la escena de una invasión a una casa en Tulsa, Oklahoma (EEUU)."
185,"marzo 02, 2021",´Peló’ a sus jefes en sus narices,"Empleada de un patio de venta de carros se habría transferido a su cuenta 50 mil dólares para gastárselos en ""vanidades"""
186,"marzo 02, 2021",Quito: Hombre se hace pasar por ciclista para robar,Varias personas han sufrido robos con esta modalidad. El hombre les distrae con su supuesta experiencia en el ciclismo. Ocurrió en el Valle de Los Chillos
187,"marzo 01, 2021",¡Abrakadabra! Tres sujetos entran a las casas por arte de magia,"Al ver las fotos de los sospechosos, una vecina de San Antonio se animó a contar su historia"
188,"marzo 01, 2021",¡Se vistieron de futbolistas para robar en domicilios de Ambato!,Los 20 sospechosos recibieron prisión preventiva.
189,"febrero 26, 2021","Con un destornillador, dos ladrones pretendían 'bajarse' una motoneta",La Policía detuvo a dos asaltantes en el centro de Guayaquil. Sus dos compinches huyeron
190,"febrero 26, 2021",Se ‘pateó’ una patrulla estatal,Borrachito aprovechó que el vigilante estaba ocupado en un procedimiento para llevársela
191,"febrero 25, 2021",Asaltaron a brigada médica de la Prefectura de Santa Elena,Hasta la camioneta de la entidad se la llevaron. El atraco ocurrió en vía Chanduy-Engunga
192,"febrero 25, 2021",¡Les cayó la ley a los talleres mecánicos clandestinos!,Hay tres personas detenidas y tres automotores y una motocicleta retenidos en esos locales que presuntamente funcionan al margen de la ley
193,"febrero 24, 2021",Hasta las ollas se robaron de una escuela,Pillos derribaron una pared de concreto para desmantelar el plantel educativo
194,"febrero 24, 2021",La ‘dan duro’ al robo de tapas de alcantarilla en Quito,"Solo en enero, se reportaron más de 164 rejillas en la capital. La multa por estos actos es de 200 dólares."
195,"febrero 24, 2021",Guayaquil: El 'choreo' de automotores no tiene freno,En apenas tres horas del martes 23 de febrero fueron rescatados tres vehículos por la Policía
196,"febrero 23, 2021","En Quito, la cámara de un hombre grabó su asesinato","Un video registró el momento en que la víctima fue atacada por un sujeto, quien también le robó el celular. La Policía investiga el caso"
197,"febrero 20, 2021",Le agujerearon la cabeza de un balazo,Un muerto y una mujer herida dejó el robo a una hacienda bananera de El Oro. Encapuchados atacaron en Machala
198,"febrero 19, 2021",¡Dos hombres fueron acribillados en Machala!,Una de las víctimas tenía antecedentes penales por delito de robo y cada semana debía presentarse a la Fiscalía para firmar
199,"febrero 18, 2021",Puebloviejo: joven fue atado con los cordones de sus zapatos para robarle,Delincuentes se llevaron 3.000 dólares de un local comercial del cantón Puebloviejo
200,"febrero 18, 2021",'Cuartel de las feas' fue desarticulado en el sur de Guayaquil,Dos mujeres y tres hombres fueron detenidos por presuntamente alquilar armas de fuego para cometer delitos.
201,"febrero 17, 2021",Solo 20 minutos disfrutaron tres venezolanos de un auto robado,"Los sospechosos fueron capturados en Puente Lucía, cuando salían de Guayaquil con rumbo a Daule"
202,"febrero 13, 2021",Crimen de Efraín Ruales se reconstruirá en 3D,"No existen detenidos por la muerte del presentador. Hasta el momento, alias Casquete está procesado por el robo del vehículo usado por los criminales."
203,"febrero 12, 2021",Tania Realpe dice estar pasando una mala racha,"La artista fue víctima de la delincuencia, se le llevaron algunas de sus pertenencias. Además, se contagió de COVID-19 y ya se está recuperando"
204,"febrero 12, 2021",Detienen a ladrón que robaba 'de lo lindo' con un cuchillo,"El capturado le robó el celular a una chica, quien se encontraba con una amiga. El hecho ocurrió en la ciudadela Sauces 1, norte de Guayaquil"
205,"febrero 12, 2021",¡Roban a periodista deportivo en vivo y directo!,"El comunicador Diego Ordinola se encontraba en los exteriores del estadio Monumental, cuando fue apuntado con un revólver"
206,"febrero 12, 2021",Dos detenidos en El Recreo se paseaban con un 'mata chancho',Dos sujetos fueron aprehendidos en la parte posterior de la segunda etapa de El Recreo. Ellos serían los causantes de un robo ocurrido esta semana.
207,"febrero 10, 2021",En Portoviejo: Hizo flete con la ’pelona’,"Una de las víctimas encontrada en el portamaletas de un vehículo registra 9 procesos por robo, tentativa de asesinato y asociación ilícita."
208,"febrero 10, 2021",Expolicía recibió un ‘plomazo’ por resistirse al robo de su celular,"El crimen ocurrió en un terreno baldío ubicado en la ciudadela Bellavista, en el norte de Guayaquil"
209,"febrero 10, 2021",Quito: ¡Se quedó sin vender su auto y sin celular!,Un joven fue víctima de robo en un semáforo de Quito. Le preguntaron si vendía su carro para distraerlo.​
210,"febrero 09, 2021",Ya ni en Isla Mocolí se salvan del hampa,Agarran y procesan a sospechoso del robo de materiales de construcción en una urbanización de esa zona fuertemente custodiada
211,"febrero 08, 2021","En EE. UU. acribillan a bloguero que simuló un ""robo de broma"" para su canal en YouTube",Timothy Wilks llevaba cuchillos de carnicero como parte del truco. David Starnes no lo sabía y disparó mortalmente al joven para defenderse
212,"febrero 07, 2021",Elecciones 2021: Unas 500 personas retiradas de parques de Guayaquil por infringir la Ley seca,Desde el viernes se han ejecutado 1.295 operativos que dejan también 19 detenidos por delitos de robo y se incautaron cuatro armas de fuego.
213,"febrero 07, 2021",Caso Efraín Ruales: ¡‘Cana’ y protección para Casquete!,"El individuo fue procesado por el robo del vehículo utilizado en el asesinato del presentador Efraín Ruales Ríos, en Guayaquil."
214,"febrero 06, 2021",Caso Efraín Ruales: Investigado por muerte será enviado a la cárcel 4,Sospechoso en la muerte de Ruales será enviado a Quito. Lo procesaron por el robo del carro en el que viajaban los asesinos del actor.
215,"febrero 05, 2021",Caso Efraín Ruales: Sospechosos detenidos escondían teléfonos y dinero en el tumbado,La Policía y la Fiscalía llegaron a ellos por la investigación abierta por el robo del vehículo utilizado en el asesinato del presentador. Encontraron un casquillo 9 milímetros.
216,"febrero 05, 2021",En Guayaquil 'pillan' al comprador y a dos 'vendedores' de cables de fibra óptica robados,La policía capturó a implicados en el robo y comercialización de productos de una empresa de telecomunicaciones
217,"febrero 05, 2021","Nueve avivatos de una banda fueron capturados en Guayas, El Oro y Loja","La organización desarticulada se dedicaba al robo de vehículos, secuestro y otros delitos. Los detenidos serán procesados por asociación ilícita"
218,"febrero 04, 2021",Delincuente escaló un condominio para robar en un gimnasio,"Al final, para escapar, el pillo saltó desde un balcón de aproximadamente cinco metros de altura. Se llevó un televisor y dinero en efectivo."
219,"febrero 03, 2021",Cargaron con la caja fuerte de las recaudaciones en Daule,Investigan al guardia que estuvo de turno a la hora que habrían ingresado a la dependencia y se llevaron el implemento de seguridad
220,"febrero 03, 2021",Guardia con medidas sustitutivas por una muerte registrada en una parada de bus,El implicado en un robo falleció luego de ser sometido en el sur de Quito
221,"febrero 03, 2021",Banda de falsos policías se llevaron 11 'lucas' de una avícola,"Varios delincuentes disfrazados de oficiales de la Policía Judicial asaltaron una avícola en la cooperativa Paraíso de la Flor, noroeste de Guayaquil."
222,"febrero 02, 2021","Se ‘bajaron’ a Trenzas en un andén de buses, en el sur de Quito",El guardia que habría detenido al sospechoso y la mujer a quien supuestamente le intentó robar son investigados por la Policía.
223,"febrero 02, 2021",Fueron a investigar un robo en La Alborada y hallaron a un tipo con 100 cápsulas de heroína,"En esa ciudadela del norte de Guayaquil, el sospechoso que llevaba la droga se delató a sí mismo al ponerse nervioso"
224,"febrero 02, 2021",Quisieron hacerle el 'pele' a camaronera de El Morro,"La Policía llegó cuando los antisociales salían con un camión cargado de motores, electrodomésticos y otros objetos. Los pillos pudieron escapar"
225,"febrero 02, 2021",Caen dos sujetos armados en el sur de Guayaquil,"Uno de los sospechosos tiene una detención anterior y se hizo ""conocido"" por un vídeo viral en el que patea a una de sus víctimas mujeres"
226,"febrero 02, 2021",Reo fugado es recapturado en Sucumbíos,El interno salió por un hueco en una pared del Centro de Rehabilitación Social de Lago Agrio. Lo detuvieron a mediados de enero por el delito de robo.
227,"enero 31, 2021",Hombre fue asesinado a puñal por un celular,"El sujeto apareció sin vida, en el norte de Quito. Según las pericias, él quiso robarle un celular a un chico, quien le habría ‘dado el vire’."
228,"enero 31, 2021",Detienen a un pillo 'patojo' en el sur de Guayaquil,El ciudadano tiene una pierna lastimada y habría cometido un robo el 8 de enero. Hoy andaba con un sujeto en una moto y ambos fueron atrapados
229,"enero 29, 2021",Detienen a presuntos implicados en un robo de tres 'lucas',"La víctima fue un ciudadano chino. Los tres involucrados quisieron huir en un auto, pero el 'populacho' apedreó el carro y casi los lincha"
230,"enero 28, 2021","""Eran para mi madre"", dijo un jefe de bomberos en Florida, buscado por robo de vacunas",El legionario se entregó a la Policía al saber que un subordinado había sido detenido por el mismo caso de sustracción de dosis contra la Covid-19
231,"enero 27, 2021",'Pillo' se paseó por la casa mientras todos dormían,Delincuente ingresó a una vivienda mientras toda la familia dormía. El sujeto aprovechó para revisar todo y llevarse varios aparatos electrónicos.
232,"enero 27, 2021","""$ 1.800 y te devolvemos el auto"", la exigencia de extorsionadores a víctimas de robo",Apresan a dos sujetos que exigíandinero a cambio del vehículo que se habían robado
233,"enero 26, 2021",¡Atrapados por los lechuguines del río Daule!,"Dos supuestos ladrones de un auto, que huían de la Policía, fueron aprehendidos a la altura del recinto Puente Lucía, en el norte de Guayaquil"
234,"enero 23, 2021",Esto puedes hacer si tu 'bendición' presencia un 'choreo',Ser víctima de un robo afecta a las emociones y más cuando se aplica la violencia. En niños es más impactante porque no entienden lo que pasa. Trata de darle paz; si no puedes busca ayuda profesional
235,"enero 22, 2021",Hampones cogieron de 'patos' a no videntes,"Se les llevaron hasta los zapatos a los esposos, comerciantes de golosinas en Manta"
236,"enero 22, 2021",¡Cayeron los del asalto a la joyería del centro de Guayaquil!,La Policía detiene en el sector de La Chala a implicados en el robo del 20 de enero a un local en el centro y la justicia les dicta prisión preventiva
237,"enero 21, 2021",Lloró por clemencia luego de agredir y robar un celular; pero igual fue denunciado,El sospechoso robó a una mujer pero cuando fue detenido por el populacho empezó a llorar e indicó que su fechoría fue por su mamá.
238,"enero 21, 2021",Delincuentes asaltan con armas de fogueo y balas de goma para evitar penas altas,"El último caso se registró en Guayaquil. Un hombre fue asaltado, golpeado y disparado, pero no sufrió lesiones graves."
239,"enero 21, 2021",¡Robo de 25 mil dólares en urbanización de Samborondón!,"Un grupo de delincuentes llegó por el río Daule e ingresó a un inmueble, la noche del miércoles 20 de enero"
240,"enero 20, 2021",Le ‘pelaron’ la casa a un policía,"Pillos aprovecharon su ausencia para llevarse la mayor parte de los enseres de su casa, en Manabí"
241,"enero 20, 2021",Desvalijaron joyería en el centro de Guayaquil,"Un hombre llegó a averiguar por un anillo de matrimonio, pero luego sacó un arma y se llevó varias joyas y los celulares del dueño y de otro cliente"
242,"enero 19, 2021",¡'Ladronde' lleva esas piezas de auto!..,"Durante un control vehicular en Pascuales, la Policía detectó las partes de un auto robado en 2016. Su portador no supo qué decir al respecto"
243,"enero 19, 2021",Robo de cámara en Guamaní: ¡Hasta la ‘ñata’ salió en la grabación!,Un hombre es sospechoso del hecho. Habría escalado un porte para llevarse el equipo de vigilancia. La Policía investiga el hecho.
244,"enero 18, 2021",¡Pasajeras asaltadas y violadas en taxi amarillo!,"Dos casos se registraron la noche del domingo 17 de enero, en Guayaquil. Tres sospechosos fueron detenidos horas después."
245,"enero 18, 2021",Le destrozaron el cráneo en bananera orense,Dos sujetos llegaron en una moto y descargaron dos balazos en contra del jornalero. Moradores presumían que se trataba de un robo
246,"enero 18, 2021",Lo amenazaron con un cuchillo porque los cachó con las ‘manos en la masa’,"Vecino de Conocoto, en el suroriente de Quito, vio cuando unos sujetos le robaban el cerebro del auto. Uno de ellos lo amenazó antes de huir."
247,"enero 17, 2021",Ahora 'vuela' con Dios,"Lorena Pazmiño traficó, robó y se prostituyó. Antes andaba ‘voladota’ por la marihuana, hoy dice que se ‘embriaga’ en el Espíritu Santo. Predica con su esposo en el barrio que la vio nacer, la ‘bahía de la droga’, en 10 de Agosto y Guerrero Martínez, oeste de Guayaquil."
